{"$schema":"https://json-schema.org/draft/2020-12/schema","$id":"design-element-map.schema.json","type":"object","additionalProperties":false,"required":["schema_version","artifact_type","deck_id","slide_id","generated_layer_sha256","prompt_package_sha256","elements","forbidden_generated_content","full_raw_layer_reuse_allowed","host_map_pass_count","map_correction_count","status"],"properties":{"schema_version":{"const":"1.0"},"artifact_type":{"const":"design_element_map"},"deck_id":{"type":"string","minLength":1},"slide_id":{"type":"string","minLength":1},"generated_layer_sha256":{"$ref":"#/$defs/hash"},"prompt_package_sha256":{"$ref":"#/$defs/hash"},"elements":{"type":"array","minItems":1,"items":{"$ref":"#/$defs/element"}},"forbidden_generated_content":{"type":"object","additionalProperties":false,"required":["text_like_marks","logo_like_marks","unauthorized_labels","duplicate_resolved_icons","duplicate_chart_content","unclassified_major_visual_count"],"properties":{"text_like_marks":{"type":"boolean"},"logo_like_marks":{"type":"boolean"},"unauthorized_labels":{"type":"boolean"},"duplicate_resolved_icons":{"type":"boolean"},"duplicate_chart_content":{"type":"boolean"},"unclassified_major_visual_count":{"type":"integer","minimum":0}}},"full_raw_layer_reuse_allowed":{"type":"boolean"},"host_map_pass_count":{"const":1},"map_correction_count":{"type":"integer","minimum":0,"maximum":1},"status":{"const":"submitted"}},"$defs":{"hash":{"type":"string","pattern":"^[a-f0-9]{64}$"},"norm":{"type":"integer","minimum":0,"maximum":10000},"bbox":{"type":"object","additionalProperties":false,"required":["x","y","w","h"],"properties":{"x":{"$ref":"#/$defs/norm"},"y":{"$ref":"#/$defs/norm"},"w":{"type":"integer","minimum":1,"maximum":10000},"h":{"type":"integer","minimum":1,"maximum":10000}}},"element":{"type":"object","additionalProperties":false,"required":["element_id","source_ref","element_owner","reconstruction_class","editable_required","fidelity_priority","p4_strategy","normalized_bbox","z_index","relationship_refs"],"properties":{"element_id":{"type":"string","minLength":1},"source_ref":{"type":["string","null"]},"element_owner":{"enum":["deterministic_compositor","generated_visual_layer"]},"reconstruction_class":{"enum":["native_shape","native_text","native_chart","sanitized_svg","reusable_raster","generated_background","generated_foreground","decorative_approximation"]},"editable_required":{"type":"boolean"},"fidelity_priority":{"enum":["critical","major","minor"]},"p4_strategy":{"enum":["rebuild_from_element_map","reuse_authority_text_spec","reuse_powerpoint_chart_spec","reuse_authority_asset","extract_from_raw_layer","reuse_background_raster","rebuild_background_from_style_tokens","approximate_from_style_tokens"]},"normalized_bbox":{"$ref":"#/$defs/bbox"},"z_index":{"type":"integer","minimum":0},"shape_kind":{"enum":["rect","rounded_rect","ellipse","line","arrow","chevron","triangle","simple_polygon"]},"fill":{"type":"string"},"border":{"type":"string"},"corner_radius":{"type":"integer","minimum":0,"maximum":5000},"opacity":{"type":"integer","minimum":0,"maximum":1000},"shadow_class":{"enum":["none","soft","medium"]},"relationship_refs":{"type":"array","uniqueItems":true,"items":{"type":"string","minLength":1}}}}}}
