{
  "schema_version":"1.0","artifact_type":"design_element_map","deck_id":"D03","slide_id":"S01","generated_layer_sha256":"7eefbf032623a6ac5f98f2d30a85344ab61260a51a08110874e81743478eaa22","prompt_package_sha256":"5a7537e2b813469be3e40f11c10715d9298bb4d414d4cf5873522479dce2a249",
  "elements":[
    {"element_id":"GEN-S01-BG01","source_ref":null,"element_owner":"generated_visual_layer","reconstruction_class":"generated_background","editable_required":false,"fidelity_priority":"major","p4_strategy":"rebuild_background_from_style_tokens","normalized_bbox":{"x":0,"y":0,"w":10000,"h":10000},"z_index":0,"relationship_refs":[]},
    {"element_id":"EL-S01-TITLE","source_ref":"S01-TITLE","element_owner":"deterministic_compositor","reconstruction_class":"native_text","editable_required":true,"fidelity_priority":"critical","p4_strategy":"reuse_authority_text_spec","normalized_bbox":{"x":500,"y":450,"w":4800,"h":1200},"z_index":20,"relationship_refs":[]},
    {"element_id":"EL-S01-C01","source_ref":"S01-C01","element_owner":"deterministic_compositor","reconstruction_class":"native_text","editable_required":true,"fidelity_priority":"critical","p4_strategy":"reuse_authority_text_spec","normalized_bbox":{"x":500,"y":1650,"w":3500,"h":1100},"z_index":20,"relationship_refs":[]},
    {"element_id":"EL-S01-V01","source_ref":"S01-V01","element_owner":"generated_visual_layer","reconstruction_class":"reusable_raster","editable_required":false,"fidelity_priority":"major","p4_strategy":"extract_from_raw_layer","normalized_bbox":{"x":1900,"y":1300,"w":6500,"h":6500},"z_index":10,"relationship_refs":[]},
    {"element_id":"GEN-S01-DECOR-TOP","source_ref":null,"element_owner":"generated_visual_layer","reconstruction_class":"decorative_approximation","editable_required":false,"fidelity_priority":"minor","p4_strategy":"approximate_from_style_tokens","normalized_bbox":{"x":6100,"y":0,"w":3900,"h":2400},"z_index":2,"relationship_refs":[]},
    {"element_id":"GEN-S01-DECOR-BOTTOM","source_ref":null,"element_owner":"generated_visual_layer","reconstruction_class":"decorative_approximation","editable_required":false,"fidelity_priority":"minor","p4_strategy":"approximate_from_style_tokens","normalized_bbox":{"x":0,"y":7550,"w":3900,"h":2450},"z_index":2,"relationship_refs":[]}
  ],
  "forbidden_generated_content":{"text_like_marks":false,"logo_like_marks":false,"unauthorized_labels":false,"duplicate_resolved_icons":false,"duplicate_chart_content":false,"unclassified_major_visual_count":0},"full_raw_layer_reuse_allowed":false,"host_map_pass_count":1,"map_correction_count":0,"status":"submitted"
}
